### ISSUE TITLE
Networking Issue on System Reboot

### ISSUE THREAD

**Issue by mattdombrowski21** [containers/libpod#3814]
**Is this a BUG REPORT or FEATURE REQUEST? (leave only one on its own line)**

/kind bug

**Description**
I seem to have found an interesting bug dealing with how the container networking is setup on system reboots. The container I am trying to run is created and launched by systemd and is enabled on restart. 
Here is the service file for my container:
```
[Unit]
Description = Squid Proxy Container Service
Wants       = network.target

[Service]
Restart = always
Type = simple
RemainAfterExit = yes
ExecStart = /usr/bin/podman run -dt -v /etc/squid/squid.conf:/etc/squid/squid.conf:Z -p 3128:3128 --name squid-cont squid-img
ExecStop = /usr/bin/podman stop -t 2 squid-cont
ExecStop = /usr/bin/podman rm squid-cont

[Install]
WantedBy = multi-user.target
```

When the system is running, starting and stopping the service works as expected. However, on reboots, the container is created, but I am unable to reach it externally via port 3128. I have made sure it's not a firewall issue and have even tried using a different port and disabling the firewall to help debug the issue. 

**Steps to reproduce the issue:**

1. Create the service file and place it in /usr/lib/systemd/system/

2. Enable the service

3. Reboot

**Describe the results you received:**
I am unable to reach the container via port 3128. Sending a ping to 1.1.1.1 from within the container (using podman exec) results in the following when doing a tcpdump on the host system (note that this is listening on all interfaces):
```
[Interface:veth10d87c76:]    10:02:56.349301 IP 10.88.1.201 > 1.1.1.1: ICMP echo request, id 54, seq 1, length 64
[Interface:cni0:]    10:02:56.349301 IP 10.88.1.201 > 1.1.1.1: ICMP echo request, id 54, seq 1, length 64
[Interface:ens192:]    10:02:57.373370 IP 10.88.1.201 > 1.1.1.1: ICMP echo request, id 54, seq 1, length 64
```

The ip address of my container is 10.88.1.201 and the host machine's ip is 10.11.4.34. As you can see, there must be some sort of NAT issue between the cni0 interface and the ens192 interface where the ip is not translated over. 

**Describe the results you expected:**

The expected output from tcpdump if things were working properly would be like this:
```
[Interface:veth10d87c76:]    10:02:56.349301 IP 10.88.1.201 > 1.1.1.1: ICMP echo request, id 54, seq 1, length 64
[Interface:cni0:]    10:02:56.349301 IP 10.88.1.201 > 1.1.1.1: ICMP echo request, id 54, seq 1, length 64
[Interface:ens192:]    10:02:57.373370 IP 10.11.4.34 > 1.1.1.1: ICMP echo request, id 54, seq 1, length 64
```

**Additional information you deem important (e.g. issue happens only occasionally):**
To further complicate things, restarting the service will resolve the problem and the ip translation between the interfaces works as expected. Additionally, bringing up another container will resolve the issue and I am able to reach the original container as expected. Turning off the second container will bring the issue back though. 

The only time I am seeing this problem is when the container is launched as a service on startup after rebooting the system.

**Output of `podman version`:**

```
Version:       1.0.3
Go Version:    go1.11.5
OS/Arch:       linux/amd64
```

**Output of `podman info --debug`:**

```
debug:
  compiler: gc
  git commit: ""
  go version: go1.11.5
  podman version: 1.0.3
host:
  BuildahVersion: 1.6-dev
  Conmon:
    package: podman-1.0.3-1.git9d78c0c.module+el8.0.0.z+3717+fdd07b7c.x86_64
    path: /usr/libexec/podman/conmon
    version: 'conmon version 1.14.0-dev, commit: 41dd7cbcb7ac477dd3553d1eeee82923a7ac221d-dirty'
  Distribution:
    distribution: '"rhel"'
    version: "8.0"
  MemFree: 2453577728
  MemTotal: 3964936192
  OCIRuntime:
    package: runc-1.0.0-55.rc5.dev.git2abd837.module+el8.0.0+3049+59fd2bba.x86_64
    path: /usr/bin/runc
    version: 'runc version spec: 1.0.0'
  SwapFree: 2147479552
  SwapTotal: 2147479552
  arch: amd64
  cpus: 2
  hostname: crio.lan
  kernel: 4.18.0-80.4.2.el8_0.x86_64
  os: linux
  rootless: false
  uptime: 1h 42m 22.84s (Approximately 0.04 days)
insecure registries:
  registries: []
registries:
  registries:
  - registry.redhat.io
  - quay.io
  - docker.io
store:
  ConfigFile: /etc/containers/storage.conf
  ContainerStore:
    number: 5
  GraphDriverName: overlay
  GraphOptions: null
  GraphRoot: /var/lib/containers/storage
  GraphStatus:
    Backing Filesystem: xfs
    Native Overlay Diff: "true"
    Supports d_type: "true"
    Using metacopy: "false"
  ImageStore:
    number: 19
  RunRoot: /var/run/containers/storage
```

**Additional environment details (AWS, VirtualBox, physical, etc.):**
This is being done in a virtual machine using ESXi

**Comment by mheon** [comment]
I suspect that part of the problem here is tracking the Podman executable, and not Conmon (though I suspect that `--conmon-pidfile` didn't land in Cent/RHEL 8.0 so that may not be possible until 8.1). The container is probably not being removed by the `ExecStop` line on system shutdown - so you're working with an older copy after the system restarted.

(Could be entirely wrong here, this is just a first impression, will look further later)

**Comment by mattdombrowski21** [comment]
A less than ideal workaround for this problem that I found was that having it wait for 30 seconds before  creating the container fixes the issue. I just added "ExecStartPre = /bin/sleep 30" and it worked. Of course this is not a great solution and I am wondering if there is some other service that I do not realize needs to be started first.

**Comment by mheon** [comment]
Alright, looks like I'm wrong then.

I suppose it's possible that the system isn't ready to process iptables requests when we start up... `network.target` would seem to indicate we're ready to start, though. Maybe `network-online.target`, to ensure communications are ready?

**Comment by mattdombrowski21** [comment]
Just tried adding network-online.target and it still won't work

**Comment by vrothberg** [comment]
Can reproduce on Fedora 30. Will look further into where it's coming from.

**Comment by vrothberg** [comment]
The solution is to add `After=network-online.target` to the unit file. A `Wants=` is not sufficient as we need to explicitly order it.

**Comment by rhatdan** [comment]
Does `podman systemd generate` default to this?

**Comment by vrothberg** [comment]
> Does `podman systemd generate` default to this?

No, that's something we should add. Good catch, @rhatdan! I'll open an issue for it.
